[
  {
    "row_id": "src_05e4139b9053db75",
    "data_type": "crit_stat",
    "system": "skills",
    "subsystem": "crit_sources",
    "item_id": "king_crit_skill",
    "name": "King skill crit rate",
    "rarity": null,
    "level": null,
    "star": null,
    "awakening": null,
    "cost": null,
    "currency": null,
    "quantity": null,
    "limit": null,
    "unlock_condition": "skill selected",
    "effect_type": "crit_rate",
    "effect_value": 40,
    "effect_unit": "percent",
    "damage_bucket": "crit_rate",
    "debuff_type": null,
    "applies_to": null,
    "consumed_by": null,
    "source_kind": "exact",
    "confidence": "exact",
    "extraction_method": "embedded_pdf_table_verified",
    "damage_relevance": "direct",
    "long_term_value": null,
    "recommended_disposition": "profile_dependent",
    "ignore_for_dps": false,
    "needs_review": false,
    "source": {
      "source_file": "source_database_map.pdf",
      "page_or_image": 25,
      "section": "Crit Rate and Crit Damage Sources",
      "original_source_file": null
    },
    "notes": "",
    "metadata": {}
  },
  {
    "row_id": "src_ec28e68acdd765f8",
    "data_type": "crit_stat",
    "system": "skills",
    "subsystem": "crit_sources",
    "item_id": "king_evolved_crit_skill",
    "name": "King evolved skill crit rate",
    "rarity": null,
    "level": null,
    "star": null,
    "awakening": null,
    "cost": null,
    "currency": null,
    "quantity": null,
    "limit": null,
    "unlock_condition": "evolved skill active",
    "effect_type": "crit_rate",
    "effect_value": 50,
    "effect_unit": "percent",
    "damage_bucket": "crit_rate",
    "debuff_type": null,
    "applies_to": null,
    "consumed_by": null,
    "source_kind": "exact",
    "confidence": "exact",
    "extraction_method": "embedded_pdf_table_verified",
    "damage_relevance": "direct",
    "long_term_value": null,
    "recommended_disposition": "profile_dependent",
    "ignore_for_dps": false,
    "needs_review": false,
    "source": {
      "source_file": "source_database_map.pdf",
      "page_or_image": 25,
      "section": "Crit Rate and Crit Damage Sources",
      "original_source_file": null
    },
    "notes": "",
    "metadata": {}
  },
  {
    "row_id": "src_081b8936b4aec543",
    "data_type": "crit_stat",
    "system": "skills",
    "subsystem": "crit_sources",
    "item_id": "expose_weakness",
    "name": "Expose Weakness level 40 crit rate",
    "rarity": null,
    "level": null,
    "star": null,
    "awakening": null,
    "cost": null,
    "currency": null,
    "quantity": null,
    "limit": null,
    "unlock_condition": "talent level 40; global",
    "effect_type": "crit_rate",
    "effect_value": 8,
    "effect_unit": "percent",
    "damage_bucket": "crit_rate",
    "debuff_type": null,
    "applies_to": null,
    "consumed_by": null,
    "source_kind": "exact",
    "confidence": "exact",
    "extraction_method": "embedded_pdf_table_verified",
    "damage_relevance": "direct",
    "long_term_value": null,
    "recommended_disposition": "profile_dependent",
    "ignore_for_dps": false,
    "needs_review": false,
    "source": {
      "source_file": "source_database_map.pdf",
      "page_or_image": 27,
      "section": "Crit Rate and Crit Damage Sources",
      "original_source_file": null
    },
    "notes": "",
    "metadata": {}
  },
  {
    "row_id": "src_74603c3d9b3076a4",
    "data_type": "crit_stat",
    "system": "skills",
    "subsystem": "crit_sources",
    "item_id": "king_evolved_crit_skill",
    "name": "King evolved skill crit damage",
    "rarity": null,
    "level": null,
    "star": null,
    "awakening": null,
    "cost": null,
    "currency": null,
    "quantity": null,
    "limit": null,
    "unlock_condition": "evolved skill active",
    "effect_type": "crit_damage",
    "effect_value": 25,
    "effect_unit": "percent",
    "damage_bucket": "crit_damage",
    "debuff_type": null,
    "applies_to": null,
    "consumed_by": null,
    "source_kind": "exact",
    "confidence": "exact",
    "extraction_method": "embedded_pdf_table_verified",
    "damage_relevance": "direct",
    "long_term_value": null,
    "recommended_disposition": "profile_dependent",
    "ignore_for_dps": false,
    "needs_review": false,
    "source": {
      "source_file": "source_database_map.pdf",
      "page_or_image": 33,
      "section": "Crit Rate and Crit Damage Sources",
      "original_source_file": null
    },
    "notes": "",
    "metadata": {}
  }
]
