[
  {
    "row_id": "src_dd11e7eebb1c097a",
    "data_type": "breakpoint",
    "system": "tech_parts",
    "subsystem": "resonance",
    "item_id": "resonance_overload",
    "name": "Resonance overload unlock",
    "rarity": null,
    "level": null,
    "star": null,
    "awakening": null,
    "cost": null,
    "currency": null,
    "quantity": null,
    "limit": null,
    "unlock_condition": "resonance_energy >= 3000",
    "effect_type": "unlock",
    "effect_value": 3000,
    "effect_unit": "resonance_energy",
    "damage_bucket": null,
    "debuff_type": null,
    "applies_to": null,
    "consumed_by": null,
    "source_kind": "exact",
    "confidence": "exact",
    "extraction_method": "embedded_pdf_table_verified",
    "damage_relevance": "indirect",
    "long_term_value": null,
    "recommended_disposition": "profile_dependent",
    "ignore_for_dps": false,
    "needs_review": false,
    "source": {
      "source_file": "source_database_map.pdf",
      "page_or_image": 193,
      "section": "Resonance Overload Breakpoints",
      "original_source_file": null
    },
    "notes": "",
    "metadata": {}
  },
  {
    "row_id": "src_c4159527167633d2",
    "data_type": "breakpoint",
    "system": "tech_parts",
    "subsystem": "resonance",
    "item_id": "resonance_overload",
    "name": "Resonance overload full access",
    "rarity": null,
    "level": null,
    "star": null,
    "awakening": null,
    "cost": null,
    "currency": null,
    "quantity": null,
    "limit": null,
    "unlock_condition": "resonance_energy >= 15000",
    "effect_type": "unlock",
    "effect_value": 15000,
    "effect_unit": "resonance_energy",
    "damage_bucket": null,
    "debuff_type": null,
    "applies_to": null,
    "consumed_by": null,
    "source_kind": "exact",
    "confidence": "exact",
    "extraction_method": "embedded_pdf_table_verified",
    "damage_relevance": "indirect",
    "long_term_value": null,
    "recommended_disposition": "profile_dependent",
    "ignore_for_dps": false,
    "needs_review": false,
    "source": {
      "source_file": "source_database_map.pdf",
      "page_or_image": 193,
      "section": "Resonance Overload Breakpoints",
      "original_source_file": null
    },
    "notes": "",
    "metadata": {}
  },
  {
    "row_id": "src_fd2f97ed756edef7",
    "data_type": "breakpoint",
    "system": "tech_parts",
    "subsystem": "resonance",
    "item_id": "resonance_overload",
    "name": "Resonance overload maximum level",
    "rarity": null,
    "level": null,
    "star": null,
    "awakening": null,
    "cost": null,
    "currency": null,
    "quantity": null,
    "limit": null,
    "unlock_condition": "resonance_energy >= 15000",
    "effect_type": "max_level",
    "effect_value": 18,
    "effect_unit": "level",
    "damage_bucket": null,
    "debuff_type": null,
    "applies_to": null,
    "consumed_by": null,
    "source_kind": "exact",
    "confidence": "exact",
    "extraction_method": "embedded_pdf_table_verified",
    "damage_relevance": "indirect",
    "long_term_value": null,
    "recommended_disposition": "profile_dependent",
    "ignore_for_dps": false,
    "needs_review": false,
    "source": {
      "source_file": "source_database_map.pdf",
      "page_or_image": 193,
      "section": "Resonance Overload Breakpoints",
      "original_source_file": null
    },
    "notes": "",
    "metadata": {}
  }
]
