[
  {
    "row_id": "src_06580f3c70fbbed2",
    "data_type": "merge_rule",
    "system": "mounts",
    "subsystem": "components",
    "item_id": "mount_component",
    "name": "Merge green to blue",
    "rarity": "green",
    "level": null,
    "star": null,
    "awakening": null,
    "cost": 2,
    "currency": "mount_component_green",
    "quantity": 1,
    "limit": null,
    "unlock_condition": null,
    "effect_type": "rarity_upgrade",
    "effect_value": null,
    "effect_unit": null,
    "damage_bucket": null,
    "debuff_type": null,
    "applies_to": "blue",
    "consumed_by": null,
    "source_kind": "exact",
    "confidence": "exact",
    "extraction_method": "embedded_pdf_table_verified",
    "damage_relevance": "survival",
    "long_term_value": null,
    "recommended_disposition": "profile_dependent",
    "ignore_for_dps": true,
    "needs_review": false,
    "source": {
      "source_file": "source_database_map.pdf",
      "page_or_image": 249,
      "section": "Mount Component Merge Rules",
      "original_source_file": null
    },
    "notes": "",
    "metadata": {}
  },
  {
    "row_id": "src_670575fb66a38dc1",
    "data_type": "merge_rule",
    "system": "mounts",
    "subsystem": "components",
    "item_id": "mount_component",
    "name": "Merge blue to purple",
    "rarity": "blue",
    "level": null,
    "star": null,
    "awakening": null,
    "cost": 2,
    "currency": "mount_component_blue",
    "quantity": 1,
    "limit": null,
    "unlock_condition": null,
    "effect_type": "rarity_upgrade",
    "effect_value": null,
    "effect_unit": null,
    "damage_bucket": null,
    "debuff_type": null,
    "applies_to": "purple",
    "consumed_by": null,
    "source_kind": "exact",
    "confidence": "exact",
    "extraction_method": "embedded_pdf_table_verified",
    "damage_relevance": "survival",
    "long_term_value": null,
    "recommended_disposition": "profile_dependent",
    "ignore_for_dps": true,
    "needs_review": false,
    "source": {
      "source_file": "source_database_map.pdf",
      "page_or_image": 249,
      "section": "Mount Component Merge Rules",
      "original_source_file": null
    },
    "notes": "",
    "metadata": {}
  },
  {
    "row_id": "src_7d132e4fecda4767",
    "data_type": "merge_rule",
    "system": "mounts",
    "subsystem": "components",
    "item_id": "mount_component",
    "name": "Merge purple to purple+1",
    "rarity": "purple",
    "level": null,
    "star": null,
    "awakening": null,
    "cost": 2,
    "currency": "mount_component_purple",
    "quantity": 1,
    "limit": null,
    "unlock_condition": null,
    "effect_type": "rarity_upgrade",
    "effect_value": null,
    "effect_unit": null,
    "damage_bucket": null,
    "debuff_type": null,
    "applies_to": "purple+1",
    "consumed_by": null,
    "source_kind": "exact",
    "confidence": "exact",
    "extraction_method": "embedded_pdf_table_verified",
    "damage_relevance": "survival",
    "long_term_value": null,
    "recommended_disposition": "profile_dependent",
    "ignore_for_dps": true,
    "needs_review": false,
    "source": {
      "source_file": "source_database_map.pdf",
      "page_or_image": 249,
      "section": "Mount Component Merge Rules",
      "original_source_file": null
    },
    "notes": "",
    "metadata": {}
  },
  {
    "row_id": "src_fc24274c900a0f74",
    "data_type": "merge_rule",
    "system": "mounts",
    "subsystem": "components",
    "item_id": "mount_component",
    "name": "Merge purple+1 to gold",
    "rarity": "purple+1",
    "level": null,
    "star": null,
    "awakening": null,
    "cost": 2,
    "currency": "mount_component_purple+1",
    "quantity": 1,
    "limit": null,
    "unlock_condition": null,
    "effect_type": "rarity_upgrade",
    "effect_value": null,
    "effect_unit": null,
    "damage_bucket": null,
    "debuff_type": null,
    "applies_to": "gold",
    "consumed_by": null,
    "source_kind": "exact",
    "confidence": "exact",
    "extraction_method": "embedded_pdf_table_verified",
    "damage_relevance": "survival",
    "long_term_value": null,
    "recommended_disposition": "profile_dependent",
    "ignore_for_dps": true,
    "needs_review": false,
    "source": {
      "source_file": "source_database_map.pdf",
      "page_or_image": 249,
      "section": "Mount Component Merge Rules",
      "original_source_file": null
    },
    "notes": "",
    "metadata": {}
  },
  {
    "row_id": "src_decf3517ad43e211",
    "data_type": "merge_rule",
    "system": "mounts",
    "subsystem": "components",
    "item_id": "mount_component",
    "name": "Merge gold to gold+1",
    "rarity": "gold",
    "level": null,
    "star": null,
    "awakening": null,
    "cost": 3,
    "currency": "mount_component_gold",
    "quantity": 1,
    "limit": null,
    "unlock_condition": null,
    "effect_type": "rarity_upgrade",
    "effect_value": null,
    "effect_unit": null,
    "damage_bucket": null,
    "debuff_type": null,
    "applies_to": "gold+1",
    "consumed_by": null,
    "source_kind": "exact",
    "confidence": "exact",
    "extraction_method": "embedded_pdf_table_verified",
    "damage_relevance": "survival",
    "long_term_value": null,
    "recommended_disposition": "profile_dependent",
    "ignore_for_dps": true,
    "needs_review": false,
    "source": {
      "source_file": "source_database_map.pdf",
      "page_or_image": 249,
      "section": "Mount Component Merge Rules",
      "original_source_file": null
    },
    "notes": "",
    "metadata": {}
  },
  {
    "row_id": "src_15d6b3183f53b478",
    "data_type": "merge_rule",
    "system": "mounts",
    "subsystem": "components",
    "item_id": "mount_component",
    "name": "Merge gold+1 to red",
    "rarity": "gold+1",
    "level": null,
    "star": null,
    "awakening": null,
    "cost": 3,
    "currency": "mount_component_gold+1",
    "quantity": 1,
    "limit": null,
    "unlock_condition": null,
    "effect_type": "rarity_upgrade",
    "effect_value": null,
    "effect_unit": null,
    "damage_bucket": null,
    "debuff_type": null,
    "applies_to": "red",
    "consumed_by": null,
    "source_kind": "exact",
    "confidence": "exact",
    "extraction_method": "embedded_pdf_table_verified",
    "damage_relevance": "survival",
    "long_term_value": null,
    "recommended_disposition": "profile_dependent",
    "ignore_for_dps": true,
    "needs_review": false,
    "source": {
      "source_file": "source_database_map.pdf",
      "page_or_image": 249,
      "section": "Mount Component Merge Rules",
      "original_source_file": null
    },
    "notes": "",
    "metadata": {}
  },
  {
    "row_id": "src_0fc9d15b4511b5a6",
    "data_type": "rule",
    "system": "mounts",
    "subsystem": "components",
    "item_id": "mount_component",
    "name": "Component merge rerolls stats",
    "rarity": null,
    "level": null,
    "star": null,
    "awakening": null,
    "cost": null,
    "currency": null,
    "quantity": null,
    "limit": null,
    "unlock_condition": null,
    "effect_type": "reroll",
    "effect_value": null,
    "effect_unit": null,
    "damage_bucket": null,
    "debuff_type": null,
    "applies_to": null,
    "consumed_by": null,
    "source_kind": "exact",
    "confidence": "exact",
    "extraction_method": "embedded_pdf_table_verified",
    "damage_relevance": "survival",
    "long_term_value": null,
    "recommended_disposition": "profile_dependent",
    "ignore_for_dps": true,
    "needs_review": false,
    "source": {
      "source_file": "source_database_map.pdf",
      "page_or_image": 249,
      "section": "Mount Component Merge Rules",
      "original_source_file": null
    },
    "notes": "Merging rerolls component stats unless a stat is locked.",
    "metadata": {}
  }
]
