[
  {
    "row_id": "src_0ce5a46ee4af7b43",
    "data_type": "event_reward",
    "system": "events",
    "subsystem": "survivor_pass_exp",
    "item_id": "dailies",
    "name": "Survivor Pass EXP: Dailies",
    "rarity": null,
    "level": null,
    "star": null,
    "awakening": null,
    "cost": null,
    "currency": null,
    "quantity": 130,
    "limit": null,
    "unlock_condition": null,
    "effect_type": "pass_exp",
    "effect_value": 910.0,
    "effect_unit": "weekly_exp",
    "damage_bucket": null,
    "debuff_type": null,
    "applies_to": null,
    "consumed_by": null,
    "source_kind": "exact",
    "confidence": "exact",
    "extraction_method": "embedded_pdf_table_verified",
    "damage_relevance": "utility",
    "long_term_value": null,
    "recommended_disposition": "knowledge_only",
    "ignore_for_dps": true,
    "needs_review": false,
    "source": {
      "source_file": "source_database_map.pdf",
      "page_or_image": 222,
      "section": "Survivor Pass EXP",
      "original_source_file": null
    },
    "notes": "",
    "metadata": {
      "daily_max": 130,
      "weekly_max": 910,
      "season_max": "3640"
    }
  },
  {
    "row_id": "src_fb830acdbb6a6c9f",
    "data_type": "event_reward",
    "system": "events",
    "subsystem": "survivor_pass_exp",
    "item_id": "defeat_monsters",
    "name": "Survivor Pass EXP: Defeat monsters",
    "rarity": null,
    "level": null,
    "star": null,
    "awakening": null,
    "cost": null,
    "currency": null,
    "quantity": 90,
    "limit": null,
    "unlock_condition": null,
    "effect_type": "pass_exp",
    "effect_value": 630.0,
    "effect_unit": "weekly_exp",
    "damage_bucket": null,
    "debuff_type": null,
    "applies_to": null,
    "consumed_by": null,
    "source_kind": "exact",
    "confidence": "exact",
    "extraction_method": "embedded_pdf_table_verified",
    "damage_relevance": "utility",
    "long_term_value": null,
    "recommended_disposition": "knowledge_only",
    "ignore_for_dps": true,
    "needs_review": false,
    "source": {
      "source_file": "source_database_map.pdf",
      "page_or_image": 222,
      "section": "Survivor Pass EXP",
      "original_source_file": null
    },
    "notes": "",
    "metadata": {
      "daily_max": 90,
      "weekly_max": 630,
      "season_max": "2520"
    }
  },
  {
    "row_id": "src_5efe6cdb6b1f08a7",
    "data_type": "event_reward",
    "system": "events",
    "subsystem": "survivor_pass_exp",
    "item_id": "clear_chapters_challenges",
    "name": "Survivor Pass EXP: Clear chapters/challenges",
    "rarity": null,
    "level": null,
    "star": null,
    "awakening": null,
    "cost": null,
    "currency": null,
    "quantity": 100,
    "limit": null,
    "unlock_condition": null,
    "effect_type": "pass_exp",
    "effect_value": 700.0,
    "effect_unit": "weekly_exp",
    "damage_bucket": null,
    "debuff_type": null,
    "applies_to": null,
    "consumed_by": null,
    "source_kind": "exact",
    "confidence": "exact",
    "extraction_method": "embedded_pdf_table_verified",
    "damage_relevance": "utility",
    "long_term_value": null,
    "recommended_disposition": "knowledge_only",
    "ignore_for_dps": true,
    "needs_review": false,
    "source": {
      "source_file": "source_database_map.pdf",
      "page_or_image": 222,
      "section": "Survivor Pass EXP",
      "original_source_file": null
    },
    "notes": "",
    "metadata": {
      "daily_max": 100,
      "weekly_max": 700,
      "season_max": "2800"
    }
  },
  {
    "row_id": "src_7c2a506770c8c98d",
    "data_type": "event_reward",
    "system": "events",
    "subsystem": "survivor_pass_exp",
    "item_id": "regular_challenge",
    "name": "Survivor Pass EXP: Regular Challenge",
    "rarity": null,
    "level": null,
    "star": null,
    "awakening": null,
    "cost": null,
    "currency": null,
    "quantity": null,
    "limit": null,
    "unlock_condition": null,
    "effect_type": "pass_exp",
    "effect_value": null,
    "effect_unit": "weekly_exp",
    "damage_bucket": null,
    "debuff_type": null,
    "applies_to": null,
    "consumed_by": null,
    "source_kind": "exact",
    "confidence": "exact",
    "extraction_method": "embedded_pdf_table_verified",
    "damage_relevance": "utility",
    "long_term_value": null,
    "recommended_disposition": "knowledge_only",
    "ignore_for_dps": true,
    "needs_review": false,
    "source": {
      "source_file": "source_database_map.pdf",
      "page_or_image": 222,
      "section": "Survivor Pass EXP",
      "original_source_file": null
    },
    "notes": "",
    "metadata": {
      "daily_max": null,
      "weekly_max": null,
      "season_max": "1350-1500"
    }
  },
  {
    "row_id": "src_7eed263243320f02",
    "data_type": "event_reward",
    "system": "events",
    "subsystem": "survivor_pass_exp",
    "item_id": "path_of_trials",
    "name": "Survivor Pass EXP: Path of Trials",
    "rarity": null,
    "level": null,
    "star": null,
    "awakening": null,
    "cost": null,
    "currency": null,
    "quantity": 50,
    "limit": null,
    "unlock_condition": null,
    "effect_type": "pass_exp",
    "effect_value": 350.0,
    "effect_unit": "weekly_exp",
    "damage_bucket": null,
    "debuff_type": null,
    "applies_to": null,
    "consumed_by": null,
    "source_kind": "exact",
    "confidence": "exact",
    "extraction_method": "embedded_pdf_table_verified",
    "damage_relevance": "utility",
    "long_term_value": null,
    "recommended_disposition": "knowledge_only",
    "ignore_for_dps": true,
    "needs_review": false,
    "source": {
      "source_file": "source_database_map.pdf",
      "page_or_image": 222,
      "section": "Survivor Pass EXP",
      "original_source_file": null
    },
    "notes": "",
    "metadata": {
      "daily_max": 50,
      "weekly_max": 350,
      "season_max": "1400"
    }
  },
  {
    "row_id": "src_64d5aaafc06d9611",
    "data_type": "event_reward",
    "system": "events",
    "subsystem": "survivor_pass_exp",
    "item_id": "ender_s_echo",
    "name": "Survivor Pass EXP: Ender's Echo",
    "rarity": null,
    "level": null,
    "star": null,
    "awakening": null,
    "cost": null,
    "currency": null,
    "quantity": 60,
    "limit": null,
    "unlock_condition": null,
    "effect_type": "pass_exp",
    "effect_value": 420.0,
    "effect_unit": "weekly_exp",
    "damage_bucket": null,
    "debuff_type": null,
    "applies_to": null,
    "consumed_by": null,
    "source_kind": "exact",
    "confidence": "exact",
    "extraction_method": "embedded_pdf_table_verified",
    "damage_relevance": "utility",
    "long_term_value": null,
    "recommended_disposition": "knowledge_only",
    "ignore_for_dps": true,
    "needs_review": false,
    "source": {
      "source_file": "source_database_map.pdf",
      "page_or_image": 222,
      "section": "Survivor Pass EXP",
      "original_source_file": null
    },
    "notes": "",
    "metadata": {
      "daily_max": 60,
      "weekly_max": 420,
      "season_max": "1680"
    }
  },
  {
    "row_id": "src_f8ef97b79cbee091",
    "data_type": "event_reward",
    "system": "events",
    "subsystem": "survivor_pass_exp",
    "item_id": "clan_expedition",
    "name": "Survivor Pass EXP: Clan Expedition",
    "rarity": null,
    "level": null,
    "star": null,
    "awakening": null,
    "cost": null,
    "currency": null,
    "quantity": null,
    "limit": null,
    "unlock_condition": null,
    "effect_type": "pass_exp",
    "effect_value": 200.0,
    "effect_unit": "weekly_exp",
    "damage_bucket": null,
    "debuff_type": null,
    "applies_to": null,
    "consumed_by": null,
    "source_kind": "exact",
    "confidence": "exact",
    "extraction_method": "embedded_pdf_table_verified",
    "damage_relevance": "utility",
    "long_term_value": null,
    "recommended_disposition": "knowledge_only",
    "ignore_for_dps": true,
    "needs_review": false,
    "source": {
      "source_file": "source_database_map.pdf",
      "page_or_image": 222,
      "section": "Survivor Pass EXP",
      "original_source_file": null
    },
    "notes": "",
    "metadata": {
      "daily_max": null,
      "weekly_max": 200,
      "season_max": "800"
    }
  },
  {
    "row_id": "src_8e18ac802816e1db",
    "data_type": "event_reward",
    "system": "events",
    "subsystem": "survivor_pass_exp",
    "item_id": "special_ops",
    "name": "Survivor Pass EXP: Special Ops",
    "rarity": null,
    "level": null,
    "star": null,
    "awakening": null,
    "cost": null,
    "currency": null,
    "quantity": 50,
    "limit": null,
    "unlock_condition": null,
    "effect_type": "pass_exp",
    "effect_value": 350.0,
    "effect_unit": "weekly_exp",
    "damage_bucket": null,
    "debuff_type": null,
    "applies_to": null,
    "consumed_by": null,
    "source_kind": "exact",
    "confidence": "exact",
    "extraction_method": "embedded_pdf_table_verified",
    "damage_relevance": "utility",
    "long_term_value": null,
    "recommended_disposition": "knowledge_only",
    "ignore_for_dps": true,
    "needs_review": false,
    "source": {
      "source_file": "source_database_map.pdf",
      "page_or_image": 222,
      "section": "Survivor Pass EXP",
      "original_source_file": null
    },
    "notes": "",
    "metadata": {
      "daily_max": 50,
      "weekly_max": 350,
      "season_max": "1400"
    }
  }
]
