[
  {
    "row_id": "src_fa17a342c33b4eea",
    "data_type": "chest",
    "system": "chests",
    "subsystem": "collectibles",
    "item_id": "collectible_chest",
    "name": "Collectible Chest",
    "rarity": null,
    "level": null,
    "star": null,
    "awakening": null,
    "cost": null,
    "currency": null,
    "quantity": null,
    "limit": null,
    "unlock_condition": null,
    "effect_type": null,
    "effect_value": null,
    "effect_unit": null,
    "damage_bucket": null,
    "debuff_type": null,
    "applies_to": null,
    "consumed_by": null,
    "source_kind": "exact",
    "confidence": "exact",
    "extraction_method": "visual_table_verified",
    "damage_relevance": "indirect",
    "long_term_value": null,
    "recommended_disposition": "profile_dependent",
    "ignore_for_dps": true,
    "needs_review": false,
    "source": {
      "source_file": "Collectible_Chest_Odds_2024-11-28_result.png",
      "page_or_image": 1,
      "section": "Collectible Chest Odds",
      "original_source_file": "Collectible_Chest_Odds_2024-11-28_result.png"
    },
    "notes": "",
    "metadata": {}
  }
]
